[
  {
    "name": "NestJS Boilerplate",
    "description": "Complete boilerplate for NestJS projects with Prisma ORM",
    "tech": "TypeScript",
    "url": "https://github.com/JohnyYen/NestJs-Template",
    "start_date": "2025-08",
    "end_date": "2025-10",
    "highlights": [
      "Modular and scalable architecture with organized folder structure",
      "Integrated Prisma ORM configuration with migrations and seeding",
      "Generic base controllers, services, and repositories",
      "Centralized app configuration and DTOs for pagination/responses",
      "Production-ready setup with Swagger auto-documentation",
      "Custom exception handling and decorators"
    ]
  },
  {
    "name": "FastAPI Template",
    "description": "Base template for creating fast, scalable APIs with FastAPI",
    "tech": "Python",
    "url": "https://github.com/JohnyYen/fastapi-template",
    "start_date": "2025-07",
    "end_date": "2025-08",
    "highlights": [
      "JWT authentication integrated",
      "SQLAlchemy async configuration with Alembic migrations",
      "Pydantic schemas for data validation",
      "Complete CRUD implementation with Repository pattern",
      "Testing configuration with pytest",
      "Docker and Docker Compose ready for deployment",
      "Automatic documentation with Swagger UI and ReDoc"
    ]
  },
  {
    "name": "Ignix Core",
    "description": "TypeScript package for building type-safe, extensible services with Result pattern and ORM-agnostic repositories",
    "tech": "TypeScript",
    "url": "https://github.com/JohnyYen/ignix-core",
    "start_date": "2026-01",
    "end_date": "2026-02",
    "highlights": [
      "Implements Result pattern for explicit success/failure handling, improving reliability",
      "Provides generic services (IService<T>) with CRUD operations and customizable DTOs",
      "ORM-agnostic repository interface supporting TypeORM, Prisma, and Sequelize",
      "Framework-flexible API handlers with adapters for NestJS, Express, Fastify, and Hono",
      "Promotes SOLID principles and type safety to reduce bugs and improve maintainability"
    ]
  },
  {
    "name": "FastAPI Generic Scaffold",
    "description": "A fully generic FastAPI scaffold architected with Screaming Architecture and Clean Architecture, featuring an automated scaffolding script that generates complete, production-ready modules — repository, service, and API layers — out of the box. The generic core is extensible through a Builder pattern, allowing custom wrappers at any layer, making it adaptable to virtually any backend domain. Includes a customizable built-in admin panel.",
    "tech": "Python",
    "url": "https://github.com/JohnyYen/extreme-fastapi-boilerplate",
    "start_date": "2026-07",
    "end_date": "",
    "highlights": [
      "Architected with Screaming Architecture and Clean Architecture for domain-driven module organization",
      "Automated scaffolding script generates ready-to-use modules with full repository, service, and API layers",
      "Extensible core with Builder pattern for adding custom wrappers at repo, service, or controller level",
      "Built-in customizable admin panel",
      "Designed for adaptability across any backend domain"
    ]
  },
  {
    "name": "hello-world-project",
    "description": "Starter template for new projects. Quick bootstrap with essential configurations and folder structure.",
    "tech": "TypeScript",
    "url": "https://github.com/JohnyYen/hello-world-project",
    "start_date": "",
    "end_date": "",
    "highlights": []
  }
]
